[
  {
    "name": "Classic Shampoo Style",
    "price_from": 42,
    "category": "Hair Styling",
    "description": "Revitalize your hair with our luxurious Classic Shampoo & Style service. This service, perfect for all hair types, begins with a consultation to personalize your style. Inhale calming scents and unwind with a scalp and neck massage, followed by a steam treatment to prep your hair. Our experts will then deliver a flawless blowout for a polished, long-lasting look.",
    "details": {}
  },
  {
    "name": "Glam Shampoo Style",
    "price_from": 58,
    "category": "Hair Styling",
    "description": "Unleash your inner star with our \"Glam Shampoo & Style\" experience. Designed for all hair types, this service transforms your locks into a red-carpet-ready masterpiece. We start with a personalized consultation to tailor your style, ensuring you radiate confidence. Breathe in calming scents and surrender to a relaxing scalp and neck massage. A steam towel preps your hair for expert shampooing and conditioning. Finally, our stylists create a simple yet stunning thermal style using heat tools, leaving you with a polished, glamorous look that lasts.",
    "details": {}
  },
  {
    "name": "Treatment",
    "price_from": 84,
    "category": "Treatments",
    "description": "Elevate your look with a Spa Inspired Treatment! Designed for all hair types, this service transforms your locks into a red-carpet-ready masterpiece. We begin with a consultation to personalize your style and recommend a targeted treatment â€“ want stronger hair? We've got you. Need deep moisture? No problem. Craving dazzling shine or a soothed scalp? We have options! Inhale calming scents and unwind with a scalp and neck massage. A steam treatment preps your hair for expert shampooing and conditioning, followed by your chosen treatment. Finally, our stylists create a simple yet stunning thermal style using heat tools, leaving you with a polished, glamorous look that lasts.",
    "details": {
      "treatment_options": [
        "5X Stronger Hair With Botanical Repair",
        "4X More Moisture With Nutriplenish",
        "Reduce Oiliness & Flakes With Scalp Solutions",
        "2X Shinier Hair With a Shine Treatment"
      ]
    }
  },
  {
    "name": "Glam Shampoo Style + The Ultimate Hair & Scalp Treatment",
    "price_from": 137,
    "category": "Treatments",
    "description": "Escape to pure bliss with our Ultimate Hair & Scalp Spa Experience, a 90-minute spa-inspired journey for complete hair renewal. Immerse yourself in three of our signature treatments, starting with the deeply hydrating Nutriplenish that quadruples your hair's moisture. Next, our Scalp Solutions treatment pampers your scalp with a 111% moisture boost and 90% reduction in oiliness. Finally, strengthen your hair from within with our botanical repair treatment, leaving it 5x stronger. To complete your transformation, we'll style your hair with a glamorous blow-dry. Throughout this luxurious service, unwind with aromatherapy, a rejuvenating scalp, neck, and back massage, invigorating steam treatments, and a touch of cryotherapy for ultimate refreshment. Book your appointment today and emerge with stunning, healthy hair and a renewed sense of well-being.",
    "details": {}
  },
  {
    "name": "Silk Press",
    "price_from": 66,
    "category": "Hair Styling",
    "description": "Achieve sleek, manageable strands with our luxurious Silk Press service, perfect for all curly or coily hair types. This pampering experience includes aromatherapy to unwind your senses, a rejuvenating scalp and neck massage, and a flawless flat iron style. For an extra moisture boost, add our Nutriplenish Deep Moisture Treatment for just $42, transforming your hair into 4x more hydrated, silky perfection.",
    "details": {
      "optional_addons": [
        {
          "name": "Nutriplenish Deep Moisture Treatment",
          "price": 42,
          "description": "Transforms your hair into 4x more hydrated, silky perfection."
        }
      ]
    }
  },
  {
    "name": "Special Event Style",
    "price_from": 69,
    "category": "Hair Styling",
    "description": "Elevate your special occasion look with our stunning \"Special Event Style.\" This service caters to all hair types and transforms your locks into an event-ready masterpiece. Relax with calming aromatherapy while our stylists pamper you with a rejuvenating scalp and shoulder massage. Following a refreshing shampoo and blow-dry, our experts will create a glamorous thermal style with simple yet elegant pinning, perfect for a romantic half-up, half-down look.",
    "details": {}
  },
  {
    "name": "Up Style",
    "price_from": 79,
    "category": "Hair Styling",
    "description": "Designed for all hair types, this service transforms your locks into a show-stopping updo fit for any special occasion. Indulge in calming aromatherapy as our stylists melt away tension with a rejuvenating scalp and shoulder massage. Following a pampering shampoo and blow-dry, our experts will meticulously craft a breathtaking upstyle, incorporating intricate detailing and luxurious texture. This isn't just a hairstyle, it's a masterpiece of artistry designed to make you feel confident and glamorous.",
    "details": {}
  },
  {
    "name": "Bridal Style",
    "price_from": 106,
    "category": "Hair Styling",
    "description": "Immerse yourself in bridal bliss with our \"Luxurious Bridal Upstyle\" experience. Designed to be the crowning touch to your wedding day look, this service caters to all hair types and transforms your locks into a timeless, elegant masterpiece. Breathe in calming aromatherapy as our stylists melt away stress with a rejuvenating scalp and shoulder massage. Following a pampering shampoo and blow-dry, our bridal hair experts will meticulously craft a breathtaking upstyle, tailored to perfectly complement your dress and desired aesthetic. Whether you envision intricate braids, cascading waves, or a romantic chignon, our artistry will ensure a flawless and long-lasting style that captures the essence of your wedding day magic.",
    "details": {}
  },
  {
    "name": "Corn Rows",
    "price_from": 90,
    "category": "Hair Styling",
    "description": "Elevate your Cornrow or Feed-In Braid Service. Our skilled stylists create intricate and stylish cornrows tailored to your desired look. Whether you prefer classic, feed-in, or intricate patterns, we'll craft a hairstyle that's both protective and fashionable. Experience the perfect blend of artistry and functionality.",
    "details": {
      "unit": "hour"
    }
  },
  {
    "name": "Feed-In Braids",
    "price_from": 150,
    "category": "Hair Styling",
    "description": "Elevate your Cornrow or Feed-In Braid Service. Our skilled stylists create intricate and stylish braids tailored to your desired look. Whether you prefer classic, feed-in, or intricate patterns, we'll craft a hairstyle that's both protective and fashionable. Experience the perfect blend of artistry and functionality.",
    "details": {
      "unit": "hour"
    }
  },
  {
    "name": "Tailored Fade",
    "price_from": 42,
    "category": "Haircut",
    "description": "Elevate your look and unwind with our signature Tailored Fade service. This comprehensive experience begins with a personalized consultation to ensure your desired fade complements your hair type and style. While you relax with soothing aromatherapy and a rejuvenating scalp and neck massage, a refreshing steam towel prepares you for our expert stylists to craft your ideal faded haircut. To empower you to maintain your sharp look, the service concludes with a personalized styling lesson. (Shortest length on sides is a .5 guard)",
    "details": {}
  },
  {
    "name": "Bald Fade",
    "price_from": 53,
    "category": "Haircut",
    "description": "Experience the ultimate bald fade with our pampering service. We start with a consultation to design the perfect fade for your head shape and hair type. Inhale calming scents while our stylists soothe your scalp and neck with a relaxing massage. A steam towel preps your hair for a flawless bald fade, expertly crafted by our team. Finally, learn how to maintain your sharp look with a personalized styling lesson. This isn't just a haircut, it's a complete bald fade transformation.",
    "details": {}
  },
  {
    "name": "Short Scissor or Razor Cut - Above the Earlobe",
    "price_from": 42,
    "category": "Haircut",
    "description": "Indulge in a pampering experience designed for your short, above-the-earlobe haircut. Our service begins with a consultation to personalize your scissor or razor cut, ensuring it flatters your features and hair type. De-stress with calming aromatherapy as our stylists treat you to a relaxing scalp and neck massage. A refreshing steam towel prepares your hair for a meticulous short cut, expertly crafted by our team. To empower you to maintain your stylish look, the service concludes with a personalized styling lesson.",
    "details": {
        "not_for": [
            "changing current length significantly -- suggest a Transformation service instead"
        ]
    }
  },
  {
    "name": "Medium Length Haircut - Jawline to Collarbone",
    "price_from": 53,
    "category": "Haircut",
    "description": "Unwind and elevate your mid-length mane with our luxurious haircut experience. We begin with a personalized consultation to create a jawline-to-collarbone cut that perfectly complements your face shape and hair texture. Breathe in calming aromatherapy as our stylists melt away tension with a rejuvenating scalp and neck massage. A refreshing steam towel preps your hair for our expert stylists to craft your ideal medium-length haircut. Finally, a personalized styling lesson empowers you to maintain your effortless, polished look.",
    "details": {}
  },
  {
    "name": "Long Haircut - Below Collarbone to Elbows",
    "price_from": 53,
    "category": "Haircut",